{
  "document_type": "invoice",
  "invoice_number": "INV-3003",
  "references_po": "PO-2002",
  "vendor": {
    "name": "Cyberdyne Systems",
    "address": {
      "street": "18144 El Camino Real",
      "city": "Sunnyvale",
      "state": "CA",
      "postal_code": "94087",
      "country": "US"
    },
    "contact": {
      "email": "billing@cyberdyne.com",
      "phone": "+1-408-555-0162"
    }
  },
  "currency": "USD",
  "issue_date": "2026-06-15",
  "line_items": [
    {
      "description": "Neural net processor",
      "quantity": 5,
      "unit_price": 1000.0,
      "line_total": 5000.0,
      "sku": "NNP-1"
    }
  ],
  "subtotal": 5000.0,
  "shipping": 0.0,
  "tax": 0.0,
  "discount": 0.0,
  "total": 5000.0
}
