{
  "document_type": "invoice",
  "invoice_number": "INV-2007",
  "vendor": {
    "name": "Wayne Ent.",
    "address": {
      "street": "1007 Mountain Dr",
      "city": "Gotham",
      "state": "NJ",
      "postal_code": "07003",
      "country": "US"
    },
    "contact": {
      "email": "vendors@wayne-enterprises.com",
      "phone": "+1-201-555-0007"
    }
  },
  "currency": "USD",
  "issue_date": "2026-05-17",
  "line_items": [
    {
      "description": "Consulting services, hrs",
      "quantity": 20,
      "unit_price": 150.0,
      "line_total": 3000.0
    }
  ],
  "subtotal": 3000.0,
  "shipping": 0.0,
  "tax": 240.0,
  "discount": 0.0,
  "total": 3240.0
}
