{
  "document_type": "invoice",
  "invoice_number": "INV-3001",
  "references_po": "PO-2001",
  "vendor": {
    "name": "Wonka Industries",
    "address": {
      "street": "1 Cocoa Lane",
      "city": "Hershey",
      "state": "PA",
      "postal_code": "17033",
      "country": "US"
    },
    "contact": {
      "email": "ap@wonka-industries.com",
      "phone": "+1-717-555-0150"
    }
  },
  "currency": "USD",
  "issue_date": "2026-06-09",
  "line_items": [
    {
      "description": "Everlasting gobstopper, case",
      "quantity": 100,
      "unit_price": 12.0,
      "line_total": 1200.0,
      "sku": "GOB-100"
    },
    {
      "description": "Fizzy lifting drink, bottle",
      "quantity": 200,
      "unit_price": 3.0,
      "line_total": 600.0,
      "sku": "FIZ-001"
    }
  ],
  "subtotal": 1800.0,
  "shipping": 0.0,
  "tax": 144.0,
  "discount": 0.0,
  "total": 1944.0
}
